1307857	I mainly participated in the working group "environmental protection and sustainable agriculture".	1308828	J'ai participé principalement au groupe de travail « Protection de l'environnement et agriculture durable ».
953202	Do you like cooking?	1182171	Aimes-tu faire la cuisine ?
3466186	With the passing of time, his respect for him became love.	3466747	Avec le temps, son respect pour lui devint de l'amour.
52395	Susan broke the dish on purpose to show her anger.	11837	Susan cassa le plat exprès pour montrer sa colère.
3649694	Golda Meir served as prime minister during the years 1969-1974.	3649886	Golda Meir a été Premier Ministre durant les années mille-neuf-cent-soixante-neuf à mille-neuf-cent-soixante-quatorze.
3724455	You're off the hook.	3960260	Vous êtes tiré d'affaire.
709097	He pissed away his inheritance on booze and loose women.	803645	Il a dilapidé son héritage en boisson et en femmes faciles.
8805709	At Tatoeba a sentence only feels good when it is accompanied by its sisters and cousins, the translations.	8805729	À Tatoeba, une phrase ne se sent bien que lorsqu'elle est accompagnée de ses sœurs et cousines, les traductions.
4665529	It's a public safety concern.	6363548	C'est un problème de sécurité publique.
1140044	We've all been laid off.	1140666	Nous avons tous été licenciés.
7813840	The medicine had a miraculous effect on him.	8571311	Le médicament eut un effet miraculeux sur lui.
5369338	Our studio is still located on Park Street.	5369532	Notre studio est toujours situé sur la rue Park.
2291575	I accept your terms.	2291723	J'accepte tes conditions.
1787896	Where are the guards?	1788167	Où sont les gardes ?
890388	Wisdom is a treasure for eternity.	1336321	La sagesse est un trésor pour l'éternité.
23683	How many bags do you have?	389536	Combien de sacs avez-vous ?
1849389	Don't disappear on me again.	1850063	Ne me lâchez pas encore une fois !
5683712	The banks rob people, and people rob the banks.	5683707	Les banques volent les gens, et les gens volent les banques.
262742	We went to the mountains to ski.	1250911	Nous sommes allés à la montagne pour skier.
3910792	We've got to rescue her.	9539073	Il nous faut la secourir.
248722	We saw what looked like an oasis in the desert.	1077092	Nous vîmes quelque chose qui semblait comme une oasis dans le désert.
2376325	I know what they're capable of.	2385938	Je sais de quoi elles sont capables.
1690433	He was very pleased with the result.	1710275	Il fut très satisfait du résultat.
2327206	I thought you were a decent young woman.	2329825	Je pensais que tu étais une jeune fille convenable.
7827728	Jacob answered: That I departed unknown to thee, it was for fear lest thou wouldst take away thy daughters by force.	8088495	Jacob répondit : j’avais de la crainte à la pensée que tu m’enlèverais peut-être tes filles.
35675	I am grateful to you for inviting me to the party.	13055	Je vous suis redevable de m'avoir invité à la fête.
780852	What is better than friendship?	781697	Quoi de mieux que l'amitié ?
2013092	Why would I want to sue you?	2013716	Pourquoi voudrais-je vous poursuivre en justice ?
34081	Fred is always telling lies.	8068464	Fred ment tout le temps.
2099986	My tooth is giving me unbelievable pain.	8553322	Ma dent me fait incroyablement mal.
528574	The audio feature is only available in some sentences in Chinese, Dutch, French, German and Shanghainese.	809672	La fonction audio n'est disponible que pour certaines phrases en chinois, en néerlandais, en français, en allemand et en shanghaïen.
23765	We must water the flower.	440298	Nous devons arroser la fleur.
1300412	Dawn clears yesterday's dreams away.	1298751	Les rêves de la veille se dissipent dans l'aube.
39123	If the door doesn't fit, you might have to shave off a bit of the wood until it closes properly.	1186252	Si la porte n'est pas bien ajustée, il te faudra poncer un peu le bois jusqu'à ce qu'elle se ferme proprement.
329553	I myself have, before becoming employed by this company, twice spoken bluntly to the people at the top.	330244	J'ai, personnellement, avant d'être employé par cette société, parlé sans détour à la hiérarchie.
562262	It was a mistake to refuse her aid.	561720	C'est une erreur d'avoir refusé son assistance.
2083052	What doesn't kill us only makes us stronger.	2083310	Ce qui ne nous tue pas ne fait que nous renforcer.
1714989	In the C language, there are two ways to pass parameters to a function: by value and by reference.	1714996	En langage C, il y a deux moyens de passer des paramètres à une fonction : soit par valeur, soit par référence.
3258705	The reign of Louis XIV lasted seventy-two years.	3258704	Le règne de Louis XIV a duré soixante-douze ans.
538857	With his crew stranded at sea, Christopher Columbus was able to save them from starvation by pulling 100 rabbits out of his hat.	930704	Avec son équipage bloqué en pleine mer, Christophe Colomb réussit à les sauver de la famine en tirant 100 lapins de son chapeau.
314403	She is five years junior to me.	134395	Elle a cinq ans de moins que moi.
1489818	How much wood would a woodchuck chuck if a woodchuck could chuck wood?	1489829	Combien de bois une marmotte jetterait-elle si une marmotte pouvait jeter du bois ?
301942	He is capable of stealing.	133030	Il est capable de voler.
1699358	The children are riding their bikes.	1704140	Les enfants font du vélo.
30925	If that's false, she's a liar.	6851436	Si c'est faux, c'est une menteuse.
6489614	It was yesterday morning when Anna saw Mr. Carter.	2890853	C'était hier matin que Anna a vu M. Carter.
1579053	Metal cases are undoubtedly tougher, but much more expensive.	1580352	Les valises métalliques sont sans aucun doute plus résistantes mais bien plus chères.
3573747	Let me give you a little tip.	7763255	Laissez-moi vous donner un petit pourboire.
7673560	Enjoy the holiday season.	9489648	Bonne fêtes de fin d'année.
25966	I'd like to know the exact exchange rate for yen.	9779	J'aimerais savoir le taux exact du change pour le yen.
2218479	You're very curious.	2228708	Vous êtes fort curieuses.
807293	Rockefeller was governor of New York.	1238034	Rockefeller a été gouverneur de New York.
5178636	Let's come back here someday.	5179081	Revenons ici un jour.
3223412	When Jack spoke, they all remained silent.	3228232	Quand Jack a parlé, elles sont tous restées silencieuses.
238322	The police pursued the stolen vehicle along the motorway.	749630	La police poursuivit le véhicule volé le long de l'autoroute.
1497770	I ate toast for breakfast.	1497953	J'ai mangé une toast au petit déjeuner.
978937	The search for "river" returns a warning that the search is illegal on Chinese Internet these days.	978945	La recherche de « fleuve » renvoie un avertissement que cette recherche est illégale sur l'Internet chinois, ces jours-ci.
876060	Loving is the essence of life.	4238163	L'amour est l'essence de la vie.
652592	What do you have to lose by asking her out on a date? A little pride maybe?	663852	Qu'as-tu donc à perdre à l'inviter à un rencard ? Un peu de fierté sans doute ?
2023323	I'll be glad to drink a glass of champagne.	2023539	Je serai heureux de boire un verre de Champagne.
4726357	I didn't warn you.	1967128	Je ne vous ai pas prévenu.
953235	Do you think it's wise to wear your uniform today?	1392370	Pensez-vous qu'il soit avisé de porter votre uniforme aujourd'hui ?
3636282	The house appears to be empty.	3640256	La maison paraît vide.
2652950	It brought a tear to my eye.	3430757	J'en ai eu les larmes aux yeux.
1890880	I'll call you a cab.	9509595	Je t'appelle un taxi.
1690551	They were panting.	1706715	Elles haletaient.
255825	I finally escaped.	960027	Je m'échappai finalement.
6102405	Scream!	8090755	Criez !
290108	He often falls in love.	1532614	Il tombe souvent amoureux.
242177	I woke up at five this morning.	1813266	Je me réveillai à cinq heures du matin.
276816	The men went hunting for lions.	140038	Les hommes sont allés à la chasse aux lions.
6935570	There's a bunch of dust bunnies under the bed.	6929231	Il y a plein de moutons de poussière sous le lit.
963929	She hung her head low in shame.	964000	Elle tenait la tête basse, en signe de honte.
509472	He chipped the edge of the tea cup.	546666	Il ébrécha le bord de la tasse à thé.
5509812	I translate, therefore I am.	6038695	Je traduis, donc j'existe.
3355253	She's a real witch!	597514	C'est une vraie sorcière !
245373	The work is mostly done.	329755	Le travail est pratiquement fait.
2065184	The media are not reporting these stories.	2065934	Les médias ne rendent pas compte de ces histoires.
306356	They made a claim for higher pay.	337385	Ils ont réclamé un salaire plus élevé.
4546785	I love egg yolks.	4546795	J'adore les jaunes d’œufs.
1334627	You punch like a girl.	1334661	Tu frappes comme une fille !
30293	Coming events cast their shadows before.	879247	Les événements à venir projettent leur ombre.
6228964	I'm sure Tommy doesn't want to be alone on Christmas Eve.	9527242	Je suis sûr que Tommy ne veut pas être seul la veille de Noël.
427666	AI means Artificial Intelligence.	430348	IA signifie Intelligence Artificielle.
17292	How many rooms are there in your house?	9027	Combien de pièces y a-t-il dans votre maison ?
7810758	No matter what you say, I'm convinced I'm right.	136290	Quoi que tu puisses dire, je suis convaincu d'avoir raison.
1682635	He's an ordinary looking guy.	1684876	C'est un type qui a l'air ordinaire.
284898	He will have no chance of winning her heart.	130116	Il n'aura aucune chance de gagner son cœur.
72126	Oh, is that the way you milk a cow?	412040	Oh, est-ce que c'est comme ça qu'on trait une vache ?
3504287	Harry took a couple of steps back.	3968096	Harry a pris du recul.
619058	I can go months without an alcoholic drink, but not even one hour without a cigarette.	816523	Je peux passer des mois sans boire d'alcool, mais pas même une heure sans cigarette.
3410915	Adam was popular.	5418903	Adam était populaire.
251775	My apartment is on the fourth floor.	422366	Mon appartement est au quatrième étage.
2334162	I hated history class.	2334276	Je détestais les cours d'histoire.
2939998	Hm! You're right!	1598930	Hm ! Tu as raison !
2282938	You have to choose your own destiny.	2283108	Il vous faut choisir votre propre destinée.
262812	We treated him in the politest manner possible.	1251130	Nous l'avons traité de la façon la plus polie possible.
44753	There were no signs of life on the island.	6195597	Il n'y avait aucun signe de vie sur l'île.
35602	What was the score at halftime?	778965	Quel était le score à la mi-temps ?
805271	Most Americans agreed with President Wilson.	986196	La plupart des Étasuniens étaient d'accord avec le président Wilson.
309557	Her manner marks her pride.	1800992	Sa conduite témoigne de son orgueil.
2720441	The brave knight saved the beautiful princess from the evil dragon.	7744695	Le courageux chevalier sauva la belle princesse du dragon maléfique.
2272845	Tommy is a pilot.	6397782	Tommy est un aviateur.
635446	I was going to run over the notes one last time, but there wasn't time.	1732741	J'allais parcourir les notes une dernière fois, mais je n'ai pas eu le temps.
34181	France used to have many colonies in Africa.	13242	La France avait de nombreuses colonies en Afrique.
8769330	Turn on your brains!	8769341	Allumez vos cerveaux !
1152169	He is constantly staring at you. He surely loves you.	948751	Il te regarde tout le temps. Il t'aime sûrement.
970919	I can't open SWF files.	965845	Je ne peux pas ouvrir de fichiers SWF.
4540427	Once upon a time there lived an emperor who was a great conqueror, and reigned over more countries than anyone in the world.	4540803	Il était une fois un empereur qui était un grand conquérant et régnait sur davantage de pays que quiconque au monde.
6783409	Begin at once to live, and count each separate day as a separate life.	1168368	Hâte-toi de bien vivre et songe que chaque jour est à lui seul une vie.
6089484	The goal of this walk was to tire us.	6084864	Cette marche avait pour but de nous fatiguer.
324137	The savage robbed me of my precious jewels and ran away.	533234	Le sauvage m'a dérobé mes précieux bijoux et s'est enfui.
9136563	I'm cleaning the house.	3556094	Je fais le ménage.
315420	She carried a baby on her back.	614275	Elle portait un bébé sur son dos.
918853	If you are going to build something in the air it is always better to build castles than houses of cards.	1018626	Si tu veux construire quelque chose en l'air, c'est toujours mieux de construire des châteaux que des châteaux de cartes.
8634642	That's a wolf.	8641490	C'est un loup.
682507	Jack has lived in Chicago for a year.	815620	Jack vit à Chicago depuis un an.
54535	The computer industry is enjoying a boom.	4572012	Le secteur informatique vit une période de croissance.
45919	The student missed class three times in a row.	837497	Cet élève a séché le cours trois fois de suite.
474995	His ideas never earned him even one penny.	558015	Ses idées ne lui rapportèrent jamais même un sou.
238026	The section chief altered the plan.	6273	Le chef de service a modifié le plan.
3399654	What a dump.	3400059	Quel taudis !
7874083	I started getting text messages in Berber.	9027797	J'ai commencé à recevoir des SMS en berbère.
5791110	Mr. Jackson is a great teacher.	5798757	M. Jackson est un professeur super.
63478	Where are you from, Karen?	441536	D'où es-tu, Karen ?
1256886	The wind blew even harder when we reached the top of the hill.	1594133	Le vent soufflait encore plus fort lorsque nous atteignîmes le sommet de la colline.
2211	When can one say that a person has alcohol issues?	4046	Quand peut-on dire qu'une personne a des problèmes d'alcool ?
4808283	The temperature is below zero today.	7243118	La température est inférieure à zéro aujourd'hui.
4009245	Detective Dan Anderson returned to Linda's house armed with a search warrant.	4009252	Le détective Dan Anderson est retourné à la maison de Linda armé d'un mandat de perquisition.
29661	The other girls are jealous of Lily because she is extremely pretty.	756802	Les autres filles sont jalouses de Lillie parce qu'elle est très jolie.
5679144	I hope you have a very merry Christmas.	9497609	J'espère que tu passeras un très joyeux Noël.
6664648	Joe has known Laur since third grade.	6848030	Joe connaît Laur depuis le CE2.
618576	It exists, but seeing as it is taboo and that nobody talks about it, there's no need to have words for it.	618468	Ça existe, mais vu que c'est un tabou et qu'on n'en parle donc pas, on n'a pas besoin de mots pour ça.
3451137	They made me an apple-pie bed, the bastards!	3432003	Ils m'ont fait mon lit en portefeuille, les salauds !
56552	Don't expose this chemical to direct sunlight.	1015377	N'exposez pas ce produit chimique à la lumière directe du soleil.
1629159	Get on your knees.	1830880	À genoux !
57424	At present it is medically impossible to cure this disease.	11440	Il est à l'heure actuelle médicalement impossible de guérir cette maladie.
2958685	Oliver was willing to sacrifice everything for you.	8237649	Oliver était prêt à tout sacrifier pour vous.
5373768	A strange beast is roaming through the woods.	5373772	Une étrange bête erre à travers les bois.
908914	My wife loves apple pie.	4247960	Ma femme adore la tarte aux pommes.
261610	I am not interested in material gain.	1967639	Je ne suis pas intéressée par le gain matériel.
9011925	It was so cold that my teeth were chattering.	1194581	Il faisait si froid que je claquais des dents.
3258719	I already knew that she had become engaged.	3258718	Je savais déjà qu'elle s'était fiancée.
32549	Max explained to Julie why he could not go to her farewell party.	15084	Max a expliqué à July pourquoi il ne pourrait pas aller à son pot de départ.
9003829	Joe is considering quitting as a last resort to hide his trace.	9003827	Joe envisage de démissionner en dernier recours pour cacher sa trace.
285214	His two sons wanted their father's house.	139076	Ses deux fils se disputaient la maison de leur père.
3890544	They charge too much for parking.	3890562	Ils demandent beaucoup trop d'argent pour un stationnement.
693384	I struck a match in the darkness.	808412	Je grattai une allumette dans l'obscurité.
1034876	The Internet has expanded the range of my sex life; it's a bit like I upgraded to ballistic missiles.	1034031	Internet a étendu le rayon d'action de ma vie sexuelle ; un peu comme si j'étais passé aux missiles balistiques.
968133	Barry Taylor's name was put forward for the position of president.	967984	Le nom de Barry Taylor a été avancé pour le poste de président.
2600125	I need some expert advice.	9576486	J'ai besoin de l'avis d'un expert.
51912	I like my steak rare.	2505863	J'aime mon bifteck saignant.
8402449	I can’t wait for the pond to freeze so that I can ice skate with my cousins.	8402447	J’ai hâte que l’étang gèle pour que je puisse patiner avec mes cousins.
49331	The house is on sale.	399887	Cette maison est en vente.
266907	In the spring, when the days grew longer and the sun warmer, she waited for the first robin to return from the south.	1194774	Au printemps, quand les jours rallongent et que le soleil chauffe plus, elle attendait le premier rouge-gorge revenant du sud.
1860494	Don't drag me into this.	2041180	Ne m'entraînez pas là-dedans.
300706	He fought a successful election campaign.	1184596	Il a fait une campagne électorale réussie.
2192542	I'll have some cereal and orange juice.	7683497	Je prendrai bien des céréales et du jus d'orange.
1933289	I flunked two of my tests.	2070753	J'ai foiré deux de mes épreuves.
5543407	I racked my mind to find a solution to the riddle but eventually failed to find one.	5544518	Je me suis creusé la tête pour trouver une solution à l'énigme mais j'ai finalement échoué pour en trouver une.
44773	The height of the tower is above 100 meters.	181243	Cette tour fait plus de 100 mètres de hauteur.
59467	I'll talk it over with Marty and see what he thinks.	336731	Je vais discuter avec Marty et voir ce qu'il en pense.
841875	The mass of men lead lives of quiet desperation.	841880	La masse des hommes vit une existence de désespoir tranquille.
22051	The opening ceremony took place on schedule.	750109	La cérémonie d'inauguration s'est déroulée selon le programme.
1813508	We hurried down the stairs.	4176754	Nous nous sommes précipités au bas des escaliers.
774301	I have a nasty feeling something's gone wrong.	1090685	J'ai le mauvais pressentiment que quelque chose s'est mal passé.
6861426	The persimmon is a sweet fruit, slightly spicy with a soft and sometimes fibrous texture.	6861251	Le kaki est un fruit sucré, légèrement relevé à la texture douce voire parfois fibreuse.
2006355	I'm bored and don't know what to do.	3432457	J'en ai assez et ne sais quoi faire.
68748	One of them is a spy.	3211614	L'une d'elles est une espionne.
6990624	Maybe the network administrator can investigate why searching for a file takes so long.	8571946	Peut-être que l'administrateur réseau peut chercher pourquoi rechercher un fichier prend tant de temps.
1634464	He's a senior.	1635898	C'est un retraité.
1140026	Would you be willing to help me clean the garage?	1140738	Seriez-vous prêtes à m'aider à nettoyer le garage ?
248243	We have to defend our country at any cost.	138632	Nous devons défendre notre pays à n'importe quel prix.
3591250	That may be an important clue.	3591577	Il se peut que ce soit un indice important.
1936456	I'd like to have dinner with you sometime.	1936868	J'aimerais dîner avec toi un de ces quatre.
243814	Nowadays, a safety zone is not always safe.	8344	De nos jours, une zone de sécurité n'est pas toujours sûre.
3258588	Victor Hugo is a very famous French writer.	3258587	Victor Hugo est un très célèbre écrivain français.
311056	As head of the sales team she reports only to the managing director.	133993	En tant que chef du service des ventes, elle ne rapporte qu'au directeur général.
662968	I think I've showed considerable constraint under the circumstances.	809764	Je pense avoir fait preuve d'une retenue considérable dans les circonstances.
243769	Nowadays it is not unusual for a woman to travel alone.	8350	De nos jours, il n'est pas inhabituel pour une femme de voyager seule.
260751	I don't like his rude manner.	127733	Je n'aime pas sa façon grossière.
7028527	Whoever has been bitten by a snake fears the slightest stick.	7028517	Qui a été mordu par un serpent craint le moindre bâton.
3368502	Bravo!	5822028	Bravo !
851127	The crocodile trapped the gnu as it tried to cross the river.	1366883	Le crocodile captura le gnou alors qu'il tentait de traverser la rivière.
6900893	Adagio in G minor by Tomaso Albinoni is one of the most appreciated pieces of classical music.	6864018	L'Adagio en sol mineur de Tomaso Albinoni est l'une des œuvres les plus appréciées de la musique classique.
2547378	I was chosen for that.	7550715	J'ai été choisi pour ça.
239836	Replace the old tires with new ones.	470677	Échangez l'ancien train de pneus contre un neuf.
1740	When you're trying to prove something, it helps to know it's true.	3560	Quand vous essayez de prouver quelque chose, ça aide de savoir que c'est vrai.
1119328	Love sucks.	1119338	L'amour, ça pue.
48862	By then Tony was in his middle sixties and still able to work hard, but he had a brand-new truck now, a new mower, a lot of other equipment and three people helping him.	4736606	À cette époque Tony avait la soixantaine bien tassée et était toujours capable de travailler dur, mais il avait désormais un tout nouveau camion, une nouvelle tondeuse, tout un tas d'autres outils et trois personnes pour l'aider.
3225982	Ordener religiously pressed this gift from his beloved against his lips.	3196422	Ordener pressa religieusement sur ses lèvres ce présent de sa bien-aimée.
805300	The new president was a warm and friendly man.	1620270	Le nouveau président était un homme chaleureux et amical.
6952746	Her speech was one of the moments that impressed me.	4613679	Son discours est un des moments qui m'ont marquée.
2268962	This newspaper has no political slant.	9679472	Ce journal n'a pas d'orientation politique.
4039357	I literally ate a dozen eggs on Easter Sunday.	4040182	J'ai littéralement mangé une dizaine d’œufs le dimanche de Pâques.
2326848	She met a boy at the county fair.	2329917	Elle a rencontré un garçon à la foire du comté.
3272972	It's better to be a winner than a loser.	3272973	C'est mieux d'être un gagnant qu'un perdant.
246977	I stayed in Japan only a few months, during which time I went through a series of hardships.	8044	Je suis resté au Japon seulement quelques mois, pendant lesquels j'ai fait face à des difficultés en série.
1716512	Thank you for closing the door.	5185576	Merci d'avoir fermé la porte.
3115808	What would happen if I pushed this button?	5680731	Que se passerait-il, si j'appuyais sur ce bouton ?
3601903	What leads you to the conclusion that I wouldn't agree?	3601197	Qu'est-ce qui te conduit à l'hypothèse que je serais contre ?
6671284	Emma had a vision.	6671288	Emma eut une vision.
2090871	I want to be an actor.	2102197	Je veux être acteur.
1699595	The product of two negative numbers is positive.	955535	Le produit de deux nombres négatifs est positif.
67200	A man was complaining of something in a sharp voice.	10599	Un homme se plaignait de quelque chose avec une voix aiguë.
3422020	The curse was broken.	5419983	La malédiction fut brisée.
292498	He is afraid of his own shadow.	131323	Il a peur de son ombre.
4269251	I want to earn a lot of money.	5927172	Je veux gagner beaucoup d'argent.
2214200	You look gorgeous in that dress.	2216311	Vous avez l'air superbe dans cette robe.
3634776	I like spending time with you.	3640497	J'aime passer du temps avec toi.
1068776	Bring your student ID!	1068924	Apporte ta carte d'étudiant !
347781	As Lincoln said to a nation far more divided than ours, we are not enemies but friends. Though passion may have strained, it must not break our bonds of affection.	785711	Comme l'a dit Lincoln à une nation bien plus divisée que la nôtre, nous ne sommes pas ennemis mais amis. Bien que la passion les ait éprouvés, elle ne doit pas briser nos liens d'affection.
1266420	Bill is en route to New York.	15101	Bill est en route pour New York.
48769	That reporter has a nose for news.	3449161	Ce journaliste a du flair pour les nouvelles.
6119494	He's leading you up the garden path.	6119503	Il te mène en bateau.
5228474	I want to be assigned to the vice squad.	8419336	Je veux être affecté à la brigade des mœurs.
290585	He was banished from the kingdom.	755813	Il fut banni du royaume.
5401651	Beware of falling rocks!	7104044	Attention aux chutes de pierres !
303855	He puts aside some money every month.	133371	Il met quelque argent de côté tous les mois.
37187	Adam became popular among teenagers as soon as he made his debut on the screen.	1693086	Adam devint populaire auprès des adolescentes dès qu'il fit ses débuts à l'écran.
32239	Mini-skirts are back in fashion again.	927236	Les mini-jupes sont de nouveau à la mode.
307183	They weren't warned of the tidal wave.	8444095	Ils n'ont pas été prévenus du raz-de-marée.
2236412	This pen doesn't write well.	3643217	Ce stylo n'écrit pas bien.
608944	We combed police records of the incident but found no mention of witnesses seeing a tall, bearded man.	817262	Nous épluchâmes les archives de police concernant cet incident mais nous ne trouvâmes aucune mention de témoins ayant vu un grand barbu.
986486	There are various kinds of candy in that bowl.	992887	Il y a différentes sortes de bonbons dans cette coupe.
535793	To catch the bull, grab its horns.	549134	Pour attraper le taureau, attrape ses cornes.
