2870189	See you all tomorrow.	4865153	Je vous verrai toutes demain.
326458	You have to respect the old.	1153563	Vous devez respecter les anciens.
9830728	Every language, like every living thing, is inherently valuable and worthy of protection and support.	9830738	Chaque langue, comme toute espèce vivante, est porteuse de valeur et digne de protection et de soutien.
2203292	We're rich.	4777285	Nous sommes riches.
3391915	Human life is sacred.	3392287	La vie humaine est sacrée.
2254570	What're you writing?	5370237	T’écris quoi ?
6088197	According to some reports, the explosion took place inside a black metal toolbox; according to others, inside a garbage can.	6088506	Certains rapports disent que l'explosion a eu lieu dans une boîte en métal noire, d'autres dans une poubelle.
1860715	Go home. Get some rest.	2040917	Rentrez chez vous ! Prenez du repos !
2646984	Jack got into the cab.	2807225	Jack est monté dans le taxi.
311643	She liked tennis and became a tennis coach.	334191	Elle aimait le tennis et devint coach.
16950	Your answer is wrong.	1991303	Votre réponse est fausse.
33132	I get goose bumps when I see a horror movie.	181139	J'ai la chair de poule lorsque je regarde un film d'horreur.
40190	Do you mind if I change the channel?	4835767	Vois-tu un inconvénient à ce que je change de chaîne ?
42866	Do you pay for it in cash or by check?	12317	Réglez-vous en liquide ou par chèque ?
1961561	I thought we could talk.	2045510	Je pensais que nous pourrions parler.
1800	Don't worry, be happy!	3513	Ne sois pas inquiet, sois heureux !
6781994	Harry is a handsome man and he turns the women's heads.	2961819	Harry est un bel homme et fait tourner la tête aux femmes.
695250	I have returned.	602058	Je suis revenue.
2244953	Are you jealous?	4403852	Es-tu jaloux ?
6249400	My bicycle is much newer than yours.	6579140	Mon vélo est beaucoup plus récent que le tien.
1327634	She tried to lift the box, but found it impossible to do.	1327846	Elle essaya de soulever la caisse mais trouva impossible de le faire.
7469480	Listen up!	8304828	Écoutez-moi bien !
584946	A perfect map would have to be as big as the territory it represents.	604724	Une carte parfaite devrait être aussi grande que le territoire qu'elle représente.
2667380	Your boyfriend is cheating on you.	4956403	Votre petit ami vous trompe.
246166	The mayor thought that he should investigate the decline in tax revenues.	1073464	La maire pensa qu'il devrait enquêter sur la chute des recettes fiscales.
2892289	This will have to be replaced.	6402391	Ceci devra être remplacé.
607736	Alan is a poet.	4271028	Alan est poète.
2539566	I was looking for a pair of scissors.	6283944	Je cherchais une paire de ciseaux.
2082720	All hope abandon ye who enter here.	2083437	Tout espoir abandonne celui qui entre ici.
2321239	James promised never to do that again.	5418947	James promit de ne jamais refaire cela.
3257	For once in my life I'm doing a good deed... And it is useless.	1441	Pour une fois dans ma vie je fais un bon geste... Et ça ne sert à rien.
20719	Look out!	2350845	Fais gaffe !
3596765	I'd like to order a pizza.	7793911	J'aimerais commander une pizza.
426810	This is a Chinese fan.	427127	C'est un fan chinois.
18306	Were there any stars in the sky?	883973	Y'avait-il des étoiles dans le ciel ?
62812	What do you want for Christmas, Jenny?	1583955	Que veux-tu pour Noël Jenny ?
2544423	I thought this was settled.	9771816	Je croyais que c'était réglé.
568188	Germans have no sense of humor? I don't find that funny.	585102	Les Allemands n'ont pas le sens de l'humour ? Ça ne m'amuse pas du tout !
298433	He is the person to lead the next generation.	431176	C'est la personne qui va mener la prochaine génération.
2737060	Chuck Norris can win a game of Connect Four in three moves.	2737061	Chuck Norris peut remporter une partie de Puissance Quatre en trois coups.
3324589	Charlie is a Red Sox fan.	3324903	Charlie est un fan des Red Sox.
1520817	You're shitting me.	1521161	Tu me racontes des conneries.
2288995	Don't tell me. Let me guess.	2289713	Ne me dites pas ! Laissez-moi le deviner !
27546	Work hard, or you'll have to take the same course again next year.	2290778	Travaille bien, car sinon tu devras recommencer ce cours l'année prochaine.
2210922	Why don't you tell me how you think it happened?	2211489	Pourquoi ne me dis-tu pas comment tu penses que ça s'est passé ?
277376	I'm sorry I'm late.	129326	Excusez mon retard.
9266845	He should calm down.	8661054	Il doit se calmer.
3258619	On the outside this building is not remarkable, but if you look inside there is a courtyard with a very beautiful garden.	3258618	De l'extérieur, ce bâtiment n'est pas exceptionnel, mais si vous jetez un coup d'œil à l'intérieur, vous verrez une cour avec un très beau jardin.
271911	It was almost a decade ago, on May 8th, 1980, that Mount St. Helens erupted.	128856	Il y a presque dix ans, le 8 mai 1980, le Mont St Helens est entré en éruption.
3344221	Mind if I join you?	2160783	Ça vous ennuie si je me joins à vous ?
244317	The crop was blasted by the severe winter.	1540157	Les récoltes furent dévastées par un hiver rude.
373233	Too bad.	373235	Tant pis !
3171305	Oscar is not dumb.	5393620	Oscar n'est pas débile.
17433	I will find you a good doctor.	477119	Je vous trouverai un bon médecin.
7496139	Could you recommend a good restaurant?	7498053	Pourriez-vous me conseiller un bon restaurant ?
454422	They used math to calculate the shape of the universe immediately before and after the Big Bang.	454239	On a utilisé les mathématiques pour calculer comment avait été formé l'univers immédiatement avant et après le Big Bang.
52997	Julie received a Christmas card from her brother in Italy.	11764	Julie a reçu une carte de Noël de son frère en Italie.
2025904	I want you to run to the store for me.	2026204	Je veux que tu coures à la boutique pour moi.
4361619	It's very hard to see yourself as others see you.	4363209	Il est très difficile de vous voir vous-même tel que les autres vous voient.
1841643	I'll get back to you.	1842995	Je te reviendrai.
2953362	The police believe the victim knew his killer.	6893599	La police croit que la victime connaissait son meurtrier.
4091858	Do it again, the same as last time.	4092953	Recommence, comme la dernière fois.
3731491	What do you say you join me for dinner?	3936928	Que dites-vous de vous joindre à moi pour déjeuner ?
2540168	I'll give you anything you ask for.	7928317	Je te donnerai tout ce que tu demandes.
294879	He wiped the sweat from his brow.	131784	Il essuya la sueur de son front.
965828	Stop stalling and do what I told you.	966389	Arrête de traîner des pieds et fais ce que je t'ai dit.
287072	His large income enables him to travel abroad every year.	389617	Son salaire important lui permet de voyager à travers le monde à chaque année.
2104911	The parking lot in the back of the school is almost empty.	2105152	Le parking à l'arrière de l'école est presque vide.
65384	AIDS can be stopped only if every person decides to take action against it.	10775	On peut arrêter le SIDA seulement si chaque personne décide d'agir contre lui.
3925031	The gang was mainly composed of drug dealers and dangerous ex-convicts.	8437063	Le gang était principalement composé de trafiquants de drogue et d'ex-détenus dangereux.
1152017	Are you kidding me?	1152024	Tu plaisantes ?
2859308	Oscar has plans.	7098991	Oscar a des projets.
1107581	I love you as a person and I hate your error.	916743	Je chéris ta personne et je hais ton erreur.
3822589	Everyone, follow me.	5490054	Suivez-moi, tout le monde.
1144353	Liliana is a girl's name and its diminutive is usually Lili, but sometimes Iana is used, Iana being the last part of the name.	1144756	Liliana est un prénom de fille et son diminutif courant est Lili, cependant Iana est parfois utilisé, étant la seconde partie du prénom.
1890705	She's having an affair.	1892161	Elle a une liaison.
2015146	I didn't want you to make a fuss.	2399029	Je ne voulais pas que tu fasses d'histoires.
67445	Oh your daughter Haru-chan is very cheerful.	428846	Ho, votre fille Haru est très enjouée.
1808185	He doesn't want you to know.	1808988	Il ne veut pas que tu saches.
2312323	Saint Patrick's Day is celebrated on March 17th.	2312375	La fête de la Saint Patrick est célébrée le 17 mars.
2396316	Please hurry. I don't have all night.	2396605	S'il vous plaît, dépêchez-vous ! Je n'ai pas toute la nuit !
1491961	It's a dog and pony show.	1492367	C'est un show à l'américaine.
1478569	The terrorists swore vengeance on that country.	1479157	Les terroristes ont juré d'exercer leur vengeance sur ce pays.
532666	He went to America to study medicine.	333356	Il alla en Amérique étudier la médecine.
3185269	Do you think it'll stay that way?	5959637	Penses-tu qu'il restera comme ça ?
2609416	My eyes weren't sharp enough to tell whether the black spot on the ceiling was a spider or a fly.	4128733	Je ne voyais pas suffisamment bien pour pouvoir dire si la tache noire sur le plafond était une araignée ou une mouche.
2314861	I did warn you.	2857266	Je t'avais prévenu.
2003752	Look at me when I'm talking to you!	2005029	Regardez-moi quand je vous parle !
280336	The company went out of business after many years of declining profits.	561849	L'entreprise cessa son activité après plusieurs années de baisse de profits.
6890548	Could someone give us a hand?	6890987	Est-ce que quelqu'un pourrait nous filer un coup de main ?
3492728	We need to talk, honey.	3515093	Il nous faut parler, mon chou.
323689	Shut up, or I'll knock you out.	180968	Ferme-la, ou je t'assomme.
2429769	Harry, wake up.	6638952	Réveille-toi, Harry !
1392418	I am afraid of heights.	1596584	Je souffre de vertige.
4297231	Keep your hands off him.	4996167	Ne le touchez pas !
6871334	Oscar filled his glass with cold water.	7672705	Oscar a rempli son verre d'eau froide.
1886151	Did you go to Oliver's funeral?	2046349	As-tu assisté à l'enterrement de Oliver ?
5819558	I asked the stranger where he was from.	5819608	Je demandai à l'inconnu d'où il venait.
293386	They decided to settle in a suburb of London.	2136544	Ils décidèrent de s'installer dans une banlieue de Londres.
1845492	Loosen up.	1158349	Calmez-vous !
3909609	Send him to me.	4550995	Faites-le venir à moi.
644349	I don't believe that some day a majority of the world's population will speak Esperanto.	2948253	Je ne pense pas qu'un jour la majorité de la population mondiale parlera Espéranto.
1702480	She just wants attention.	1703933	Elle veut juste attirer l'attention.
49881	The hotel is noted for its food.	1897189	L’hôtel est reconnu pour la qualité de la nourriture.
2852141	Let go of my hand.	4550777	Lâchez-moi la main !
773738	Just imagine that every time somebody made a grammar mistake, people only could answer "Syntax error." and leave the somebody with that.	773964	Imaginez si chaque fois que quelqu'un faisait une faute de grammaire, nous ne pouvions que lui répondre « erreur de syntaxe » en le laissant se débrouiller avec ça.
273999	I'm sorry I couldn't write to you sooner.	7427274	Je suis navré, je n'ai pas pu vous écrire plus tôt.
1244365	I always end up looking up the same words in the dictionary.	1244375	Je finis toujours par rechercher les mêmes mots dans le dictionnaire.
57738	This shop carries men's clothing.	1358037	Ce magasin propose des vêtements pour homme.
997102	You need to stop smoking.	1441053	Il faut que tu arrêtes de fumer.
243355	What shall we eat tonight?	1157816	Qu'allons-nous manger ce soir ?
6314	You are to come with me.	9426172	Il te faut m’accompagner.
3129729	Call me if anything happens.	4833434	Appelle-moi si quoi que ce soit survient !
246443	I had hardly got into the bath when the phone rang.	8036	Je venais à peine de rentrer dans mon bain quand le téléphone sonna.
2396021	Don't toy with me, Joe.	5331530	Ne jouez pas avec moi, Joe.
3730570	Do you mean to tell me you can't find one?	4110627	Veux-tu dire que tu n'arrives pas à en trouver une ?
968355	You see that chick over there? I got a boner just from looking at her.	967115	T'as vu la nana là-bas, rien que de la voir j'ai la gaule.
434788	Go back to your seats.	486709	Retournez vous asseoir.
2646777	We're friends, right?	2110090	On est potes hein ?
887498	She volunteered to go to the meeting with him.	1385501	Elle s'est portée volontaire pour aller à la réunion avec lui.
497975	He's afraid of making mistakes.	497392	Il a peur de se tromper.
3724471	George is obviously a jerk.	5385490	George est clairement un abruti.
3288312	I wish you'd told me that a bit earlier.	6402446	J'aurais apprécié que vous me disiez cela un peu plus tôt.
6287646	The man who normally loves under the sun frantically worships under the moon.	6287643	L'homme qui aime normalement sous le soleil, adore frénétiquement sous la lune.
1886362	Are we friends?	1996507	Sommes-nous amies ?
1882990	Coitus interruptus does not protect against STDs.	1883871	Le coïtus interruptus ne protège pas des maladies sexuellement transmissibles.
1028419	Harry knows a girl named Laur.	1609956	Harry connait une fille qui s'appelle Laur.
2826705	How come you ate the cucumber, you dimwit? You knew that I wanted to make a cucumber mask!	526200	Pourquoi as-tu mangé mon concombre, pauvre con ? Tu le savais que je voulais me faire un masque au concombre !
1086389	The wall is covered with graffiti.	1088813	Le mur est couvert de graffitis.
3399605	I felt guilty and sad.	3400138	Je me sentais coupable et triste.
2111945	Bring backup.	7938648	Envoyez des renforts.
887393	She smiled at him uneasily.	1339697	Elle lui sourit avec gêne.
715357	In one of my most loathed fever dreams, I had to unscramble a block of dry ramen with my mind.	2403502	Dans l'un de mes rêves enfiévrés que je déteste le plus, j'ai dû démêler, de tête, un bloc de nouilles japonaises sèches.
4012170	Do you really think Tommy will help us?	5579334	Penses-tu vraiment que Tommy nous aidera ?
3041954	Peak oil, an event based on Hubbert's theory, is the point in time when the maximum rate of petroleum extraction is reached, after which the rate of production is expected to enter terminal decline.	3144446	Le pic pétrolier, événement basé sur la théorie de Hubbert, est le point du temps auquel le taux maximal d'extraction pétrolière est atteint, après quoi, on s'attend à ce que le taux de production entre en déclin final.
3764968	Courage is an excellent virtue.	4541939	Le courage est une excellente vertu.
2547786	I'm back in business.	3453804	J'ai repris le business.
2206506	Promise me you won't to do anything stupid.	2208299	Promettez-moi que vous ne ferez rien d'irréfléchi !
1894371	Let him go!	1935631	Laisse-le s'en aller!
60879	This tape doesn't stick.	495492	Ce ruban ne colle pas.
854619	I think it would have been a better shoot with a 10mm lens.	854623	Je pense que cela aurait fait un meilleur cliché avec un objectif 10 mm.
5200628	I don't see this as a core issue.	8597621	Je ne vois pas cela comme un problème central.
3546454	He was a scaremonger, always trying to make people worry.	3951817	C'était un alarmiste, qui essayait toujours de rendre les autres anxieux.
454040	Excuse me, what is the shortest way to go to the station?	453695	Pardonnez-moi, quel est le chemin le plus court vers la gare ?
1956012	He was found mysteriously murdered.	1957715	On l'a trouvé mystérieusement assassiné.
3559755	Bake at 240ºC (thermostat 8), and lower 5 min. after to 200ºC (thermostat 6-7); let bake 10 more min. Keep an eye on the baking!	3559751	Enfourner à 240°C (thermostat 8), et baisser au bout de 5 min à 200°C (thermostat 6-7) ; laisser encore 10 min. Bien surveiller la cuisson !
2367866	He launched into a tirade about how the government is encroaching on his rights.	2368259	Il s'est lancé dans une tirade à propos de la manière dont le gouvernement empiète sur ses droits.
4013105	Can I get you a cup of tea?	7960164	Je vous sers une tasse de thé ?
6373658	And that is how he got himself out of danger.	8315145	Et c'est comme ça qu'il a échappé au danger.
1883066	She did not want him to leave.	1883804	Elle ne voulait pas qu'il parte.
698871	This fact proves her innocence.	396132	Ce fait prouve son innocence.
2197627	He's my partner.	2201337	C'est mon associé.
328663	Investing abroad on your national currency basis will not always be profitable.	139924	Investir à l'étranger sur la base de votre monnaie nationale ne sera pas toujours profitable.
838850	Dean really eats quite a lot, don't you think?	390584	Dean mange vraiment beaucoup, n'est-ce pas ?
612258	My neighbor found a cache of ancient Roman coins using his metal detector.	816658	Mon voisin a trouvé une cache de pièces romaines antiques en utilisant son détecteur de métaux.
4498731	A helicopter flew overhead.	5802001	Un hélicoptère vola au-dessus de nos têtes.
766653	Take off your jacket because it's very hot.	4996999	Retire ta veste car il fait très chaud !
5899553	I always obey the rules.	5945491	Je respecte toujours les règles.
7544822	Jacob asked Laur to get a hold of John.	7565028	Jacob demanda à Laur de contacter John.
805475	France had signed a secret treaty with Spain.	910550	La France avait signé une alliance secrète avec l'Espagne.
3374656	No one misses you.	3648736	Tu ne manques à personne.
269105	The food at the new restaurant is nothing special - average at best.	941090	La bouffe dans le nouveau restaurant n'a rien d'extraordinaire ; au mieux, moyenne.
1621345	Nature knows no boundaries.	3647459	La nature ne connaît pas de limites.
1743481	You must be in good physical condition.	1743939	Tu dois être en bonne condition physique.
4162522	Who's driving?	966598	Qui est au volant ?
51854	A splendid idea occurred to John.	761428	John a eu une merveilleuse idée.
54253	Come on, get up.	31373	Allez, lève-toi.
238289	The policeman thrust me aside.	510938	Le policier m'a poussé de côté.
312048	She's meant to practice the piano for two hours.	1118959	Elle est censée pratiquer le piano pendant deux heures.
5095121	Let no one speak.	7839597	Ne permettez à personne de parler !
2259493	There were a hundred people in the hall.	5155961	Il y avait cent personnes dans le hall.
485082	Are anal fissures curable?	4736738	Est-ce que l'on peut soigner les fissures anales ?
680802	They're taking Margaret to the emergency room.	779578	Ils emmènent Margaret à la salle des urgences.
2331806	I had to give it a try.	2431850	Il m'a fallu en faire un essai.
2007839	Let's start here.	4579625	Commençons ici !
248147	We walked ten miles that day.	5395729	Nous marchâmes 10 miles ce jour-là.
2333682	Due to its age, the cow will no longer give milk.	8932113	En raison de son âge, la vache ne donnera plus de lait.
386723	After eight months passed and his broken heart healed, George eventually started dating girls again.	394630	Après que huit mois eurent passés et que sa peine d'amour se fut évanouie, Georges recommença à sortir avec des filles.
564068	My students have been eagerly awaiting the test results.	820675	Mes étudiants ont attendu avidement les résultats de l'épreuve.
72810	Both are alive.	1011330	Ils sont tous deux vivants.
3860049	Robin Hood robbed the rich.	9821781	Robin des Bois volait les riches.
3538310	If Oscar finds out I told you this, he'll kill me.	5359200	Si Oscar découvre que je vous ai dit ceci, il me tuera.
328648	Karaoke, TV games, videos and a fridge ... love hotels nowadays really have everything.	139937	De nos jours, il y a vraiment de tout dans les love hotels... karaoké, jeux-vidéos, vidéos et un réfrigérateur.
8111685	The minority of Kabyle who support the criminal and corrupt Algerian state are Islamist Kabyle.	8111686	La minorité de kabyles qui soutiennent l'Etat algérien criminel et corrompu sont des kabyles islamistes.
56170	Are these the glasses you're looking for?	1309045	Sont-ce là les verres que tu cherches ?
953145	Back in those days, I loved to play checkers.	955091	À l'époque, j'adorais jouer aux dames.
64941	My grandma injured her leg in a fall.	5660324	Ma grand-mère s'est blessée à la jambe en tombant.
2245051	Can you cancel?	6324553	Pouvez-vous annuler ?
278583	The section chief accepted the proposal.	180234	Le chef de section a accepté la proposition.
282615	It was at that very moment that the bomb went off.	829381	C'est à ce moment précis que la bombe s'est désactivée.
1224547	I'll call you later today.	1337174	Je vous appellerai plus tard dans la journée.
1535885	Your name stands first on my list.	1536449	Ton nom figure en première place sur ma liste.
253167	I always rest for an hour after dinner.	7849230	Je me repose toujours pendant une heure après le dîner.
3678955	Figures increasingly show that the more we crack down on drug use, the more drug addicts there are.	3678530	Les chiffres montrent toujours davantage que plus on criminalise la drogue, plus il y a de drogués.
3344244	He was totally flirting with you at the bar.	3346976	Il te draguait carrément, au bar.
29739	I would rather leave early than travel on rush-hour trains.	13759	Je préférerais partir tôt plutôt que prendre le train aux heures de pointe.
73994	What does "There is a tide" imply?	135774	Que faut-il entendre par « There is a tide » ?
9019067	The police officers manacled her to a chair for questioning.	9019124	Les policiers l'ont menottée à une chaise pour l'interroger.
1628320	I feel good after a workout.	1628447	Je me sens bien après une séance de gym.
2505263	I'm Máire's fiancé.	2508089	Je suis le fiancé de Máire.
1148393	I will love you for better for worse till death us do part.	1153621	Je t'aimerai pour le meilleur et pour le pire, jusqu'à ce que la mort nous séparent.
16482	Wherever you go, you'll be welcomed.	470064	Où que vous alliez, vous serez bienvenus.
2136093	He loves soccer.	2136850	Il adore le foot.
307834	What's the accusation against him?	794275	Quelle est l'accusation portée contre lui ?
585753	Dolphins and whales are not fish.	894182	Les dauphins et les baleines ne sont pas des poissons.
405379	Close the door.	1136392	Fermez la porte !
1032101	I like the color blue.	1120610	J'aime la couleur bleue.
2953795	We should organize a party.	7089238	Nous devrions organiser une fête.
58898	I will tell him about it when he comes next time.	2504966	Je lui en parlerai la prochaine fois qu'il vient.
2044396	Were you happy?	4653809	Étiez-vous heureux ?
2165607	Everybody learns their own language and never makes any effort to learn even one word of other languages.	1950624	Tout le monde apprend leur langue et eux, ils ne font jamais l'effort d'apprendre un mot des autres langues.
313884	It seems that she is not pleased with the job.	1118200	Il semble qu’elle ne soit pas enchantée par le poste.
2111240	They're staying.	4729744	Ils restent.
1395382	To rule a country is not an easy task.	1394142	Diriger un pays n'est pas une tâche facile.
17643	What do you learn at school?	339592	Qu'est-ce que tu apprends à l'école ?
6840782	His reprise of "All Along the Watchtower" in homage to Jimi Hendrix left fans unsatisfied.	518841	Sa reprise de « All along the watchtower » en hommage à Jimi Hendrix a laissé les fans sur leur faim.
273824	The whole audience got up and started to applaud.	1200574	La totalité de l'audience se leva et commença à applaudir.
3460416	What would your mother think if she saw you like this?	3460540	Que penserait ta mère si elle te voyait ainsi ?
6089478	If this damn parrot doesn't stop screaming now I'll break its neck.	6085089	Si ce maudit perroquet n'arrête pas tout de suite de crier, je lui tords le cou.
483681	He wore a mask so no one would recognize him.	551831	Il portait un masque, de telle manière que personne ne pourrait le reconnaître.
2247469	I was convicted.	4681714	J'ai été condamné.
3719425	I think that at that time none of us quite believed in the Time Machine.	3745444	Je pense, qu'en ce temps-là, aucun de nous ne croyait tout à fait en la machine à voyager dans le temps.
2646662	You're not one of us.	4862814	Tu n'es pas des nôtres.
18963	It is no use trying to separate the sheep from the goats while in a state of madness.	390986	Il ne sert à rien d'essayer de séparer les chèvres et les moutons alors que tu es dans une crise de folie.
28212	No one can force you to do anything against your will.	13925	Personne ne peut te forcer à faire quelque chose contre ta volonté.
950104	Judging by the size of this footprint, I'd say the perp is about six feet tall.	950438	À en juger d'après la taille de cette empreinte de pas, je dirais que l'auteur du crime fait environ un mètre quatre-vingts.
2679196	The sun went down behind the mountains.	6926828	Le soleil s'est couché derrière les montagnes.
901515	Is there another word for synonym?	3162976	Y a t-il un autre mot pour « synonyme » ?
838504	I have often observed how little young ladies are interested by books of a serious stamp, though written solely for their benefit. It amazes me, I confess; for, certainly, there can be nothing so advantageous to them as instruction.	838514	J’ai souvent remarqué que les jeunes filles ne savent pas s’intéresser aux œuvres sérieuses, écrites cependant pour leur bien. Cela me confond, je l’avoue, car rien ne peut leur faire plus de bien qu’une lecture instructive.
272149	When I met my former teacher, he inquired after my parents.	645734	Quand j'ai rencontré mon ancien professeur, il m'a demandé comment allaient mes parents.
2025901	I want you to help me get out of here.	2026211	Je veux que tu m'aides à sortir d'ici.
2034502	If you want me to kiss you, all you have to do is ask.	2037245	Si tu veux que je t'embrasse, tout ce que tu as à faire est de demander.
