6982275	This room is organized chaos.	6984557	Dans cette pièce règne un chaos organisé.
887398	She stabbed him.	1408796	Elle le poignarda.
244862	A fire broke out last night and three houses were burnt down.	653937	Un incendie s'est déclaré hier soir et 3 maisons ont entièrement brûlé.
290178	He selected a pair of socks to match his suit.	836518	Il choisit une paire de chaussettes pour aller avec son complet.
28862	We were surprised at the ease with which he solved the problem.	119924	Nous avons été surpris par la facilité avec laquelle il a résolu le problème.
297368	He solicited our votes.	1124967	Il a sollicité nos votes.
1911873	The admiral is never satisfied.	1925186	L'amiral n'est jamais satisfait.
2632102	She tied up the package with string.	8552921	Elle attacha le paquet avec de la ficelle.
1294283	He who fights with monsters should look to it that he himself does not become a monster. And when you gaze long into an abyss the abyss also gazes into you.	7698294	Celui qui se bat avec des monstres doit veiller à ne pas devenir lui-même un monstre. Et quand vous regardez longtemps dans un abîme, l'abîme regarde aussi en vous.
319827	Have you finished dressing?	1339350	As-tu fini de t'habiller ?
6453961	Once a month, there was a rave in the wharf's abandoned warehouse.	9187412	Une fois par mois, il y avait une rave dans l'entrepôt abandonné du quai.
436163	How many plates do we have?	7157247	Combien d'assiettes avons-nous ?
1068769	I like elephant ears best.	1068895	Ce sont les palmiers que j'aime le plus.
5077342	We need to maintain focus.	7555047	Nous devons rester concentrés.
3618659	Harry has been taken hostage.	5334571	Harry a été pris en otage.
2985649	I want a sack of potatoes.	8218003	Je veux un sac de pommes de terre.
3346012	Are you lazy or just incompetent?	3346953	Êtes-vous fainéants ou simplement incompétents ?
607708	Relationships built on money will end when the money runs out.	607710	Les relations bâties sur de l'argent finiront lorsque s'épuisera l'argent.
1341393	I heard that you became the manager of the Sydney branch.	1533050	J'ai entendu dire que tu étais devenu le manager de la succursale de Sidney.
2195333	She caught me watching porn.	2196255	Elle m'a pris en train de regarder des trucs pornos.
297957	He brought forward a strong objection to my proposal.	132317	Il a fortement objecté à ma proposition.
245636	The child sat on his mother's lap and listened to the story.	1619048	L'enfant s'assit sur les genoux de sa mère et écouta l'histoire.
6736539	Why are you depressed?	6714965	Pourquoi êtes-vous déprimé ?
4009157	The bike was Dan's prized possession.	4009177	La moto était le bien le plus précieux de Dan.
7890202	Last September she was in Paris.	7891089	En septembre dernier, elle était à Paris.
35983	Nicole can speak Japanese very well.	337405	Nicole sait très bien parler japonais.
50242	The tape recorder has recorded his voice.	427323	Le magnétophone a enregistré sa voix.
1165794	The main tap is turned off.	1339786	Le robinet principal est fermé.
285218	His idea is superior to yours.	139079	Son idée est meilleure que la tienne.
7544228	Oliver has a dimple on his chin.	7549448	Oliver a une fossette sur son menton.
2390792	I really can't make any promises.	2392386	Je ne peux vraiment pas faire de quelconques promesses.
1138343	Do you want a glass of soda?	1331267	Voulez-vous un verre de soda ?
19564	Rub salt in the wound.	786397	Retourner le couteau dans la plaie.
21188	The smell of cut grass summons up images of hot summer afternoons.	394408	L'odeur du gazon fraîchement coupé évoque l'image de chauds après-midi d'été.
266028	We charge a commission of 3%.	338106	Nous facturons une commission de 3%.
25701	After his wife left him, Harold went nuts.	888806	Après que sa femme l'ait quitté, Harold est devenu fou.
52489	Jill says that she's happily married, but at times you'd never know it.	2149057	Jill dit qu'elle est heureuse en mariage mais, parfois, on ne s'en douterait pas.
9741177	The redbreast robin is named so due to the red feathers covering its throat and face.	6171670	Le rouge-gorge est ainsi nommé à cause des plumes rouges qui lui couvrent la gorge et également la face.
287275	His colleague was transferred to an overseas branch.	632350	Son collègue a été transféré dans une succursale à l'étranger.
963303	I'm also thinking of going to Korea.	971405	Je pense aussi aller en Corée.
5736477	The court denied the appeal.	9030487	Le tribunal a rejeté l'appel.
712974	The pastor gave a fiery sermon that left the sinners among them shaking in their boots.	802096	Le pasteur délivra un sermon enflammé qui laissa les pécheurs parmi eux trembler dans leurs bottes.
8223459	Thanks for sharing this video.	8223526	Merci de partager cette vidéo.
65651	Wendy was not always interested in Japanese festivals.	549711	Wendy n'a pas toujours été intéressée par les festivals japonais.
1553180	You cannot heal a broken heart.	4479366	Tu ne peux pas guérir un cœur brisé.
6794845	We had a magnificent time near the sea.	6453740	Nous avons eu un temps magnifique au bord de la mer.
1054574	Julian wears round glasses like John Lennon's.	1474680	Julien porte des lunettes rondes à la John Lennon.
24188	The rise in house prices enabled him to sell his house at a big profit.	628475	La hausse des prix de l'immobilier lui a permis de vendre sa maison en faisant un gros profit.
2326895	The crescent moon and star is a symbol of Islam.	2329907	Le croissant de lune et l'étoile sont un symbole de l'Islam.
671756	He who lives without madness is not as wise as he thinks.	671746	Qui vit sans folie n'est pas si sage qu'il croit.
42593	It interferes with our industrial development.	3499227	Cela interfère avec notre développement industriel.
25932	Sail along the coast.	1683360	Naviguez le long de la côte.
898035	It is generally believed that Buddhism first came to China in 67 A.D. during the reign of Emperor Mingdi of the Eastern Han Dynasty.	898249	On considère généralement que le bouddhisme est arrivé en Chine en 67 après J-C. durant le règne de l'empereur Mingdi de la dynastie des Han de l'Est.
2011889	I want a pair of gloves.	6154389	Je veux une paire de gants.
279297	The telephone is among the inventions attributed to Alexander Graham Bell.	9147119	Le téléphone fait partie des inventions attribuées à Alexander Graham Bell.
269535	I'm sorry, we don't accept checks.	128624	Je suis désolé, nous n'acceptons pas les chèques.
1827342	I have ten days to review the entire grammar of the French language.	1827346	J'ai 10 jours pour réviser toute la grammaire française.
6654491	William said he didn't think that Laur wanted to be on the basketball team.	9802987	William a dit qu'il ne pensait pas que Laur voulait être dans l'équipe de basket.
3416363	Management hid the true financial state of the company from the workers.	3422700	La direction a caché le véritable état financier de l'entreprise à ses salariés.
3071720	I want a large tube of toothpaste.	7555294	Je veux un gros tube de dentifrice.
324868	Sheep are feeding in the meadow.	1016765	Les moutons broutent au pré.
294974	He balanced himself on a log.	131792	Il s'est balancé sur un rondin.
275575	The heavy rain brought the flood, causing damage.	6845452	Les fortes pluies ont créé une inondation, causant des dégâts.
3826558	I don't think that's appropriate.	5647339	Je ne pense pas que cela soit approprié.
245726	Children play with toys.	8180	Les enfants jouent avec les jouets.
3702724	When the Russians give back Donetsk to the Ukrainians, there won't be a single building left standing.	3702450	Quand les Russes rendront Donetsk aux Ukrainiens, il n'y aura plus un bâtiment debout.
2015205	I want to go back to my quarters.	2015808	Je veux rentrer dans mes quartiers.
4305527	The bee landed on a flower.	4305710	L'abeille se posa sur une fleur.
3445653	I can squeeze you in.	3446063	Je peux t'insérer.
2674848	Since Charlie arrived at Guantanamo Bay he has been exposed to different forms of torture: sleep deprivation, sensory deprivation, extreme temperatures, prolonged isolation, lack of sunlight and limited health care.	9147080	Depuis qu'il est arrivé à Guantanamo Bay, Charlie a été soumis à diverses formes de torture : privation de sommeil et de stimulation sensorielle, températures extrêmes, isolement prolongé, exposition au soleil et soins de santé limités.
1474125	Will you please connect me with Mr. Smith?	1967501	Voulez-vous, je vous prie, me passer M. Serrurier ?
874555	Coastal cities will take the brunt of the storm.	874632	Les villes côtières recevront le plus fort de la tempête.
20348	The temperature has been below freezing for several days.	495865	La température a été en dessous de zéro depuis plusieurs jours.
28755	It is not until we lose our health that we recognise its blessing.	391980	Ce n'est que lorsque notre santé nous quitte que nous nous rendons compte de sa valeur.
328742	Controlled Access Zone: No entry without permission.	3081587	Zone d'Accès Contrôlé : entrée interdite sans autorisation.
22158	A submarine cable was laid between the two countries.	482149	On a posé un câble sous-marin entre les deux pays.
1691848	Where's the pan lid?	1691701	Où se trouve le couvercle de la poêle ?
2052103	The one with the book is Marco.	8483229	Celui avec le livre, c'est Marco.
17403	Your mother is in critical condition.	549423	Ta mère est dans un état critique.
6678562	Charlie should've done things differently.	1908015	Charlie aurait dû faire les choses différemment.
277162	Global climatic changes may have been responsible for the extinction of the dinosaurs.	129304	Un changement climatique global pourrait avoir été responsable de l'extinction des dinosaures.
6060992	Why do bumblebees buzz?	6060993	Pourquoi les bourdons bourdonnent-ils ?
623174	The judges could see no clear winner in the match and decided to declare it a draw.	815218	Les juges ne pouvaient déterminer aucun vainqueur pour le match et décidèrent de prononcer un nul.
6730682	The house is made of brick.	9736575	La maison est construite en briques.
6378458	Sami had a more deadly plan.	6378470	Sami avait un plan plus dangereux.
2400089	This doesn't taste like pork to me.	2401034	Ça n'a pas, selon moi, le goût de porc.
4079289	There was a pile of pinecones under the tree.	4080569	Il y avait une pile de pommes de pin au pied de l'arbre.
31807	Meg has a facility for languages.	15072	Meg a des facilités pour les langues.
8268191	They're catching up to us.	8549409	Ils nous rattrapent.
31784	I don't have enough RAM.	1645775	Je n'ai pas assez de mémoire vive.
270354	The ESA put a satellite into orbit.	845766	L'ASE a mis un satellite en orbite.
6331975	The Roman equivalent of the goddess Artemis was Diana.	8433388	L'équivalent romain de la déesse Artémis était Diane.
241316	Butter is sold by the pound in the USA.	4431322	On vend, aux USA, le beurre à la livre.
2415175	The question arises: "Is also the internet a means of mass communication?"	2415166	Surgit la question : « Internet est-il aussi un moyen de communication de masse ? »
1214900	He is behaving like Nelson this evening.	354176	Il se comporte comme Nelson ce soir.
5165850	She has to fix the fridge.	4176389	Il faut qu'elle répare le réfrigérateur.
3496287	His movies often feature strong female characters.	3514458	Ses films mettent souvent en scène de puissants personnages féminins.
1008581	Do you like Moscow?	6538484	Est-ce que tu aimes Moscou ?
46513	I recommend that you read that novel.	12169	Je vous recommande ce roman.
246264	The leaders were out of touch with the people.	786389	Les dirigeants étaient en déphasage avec le peuple.
273489	Abandon ship!	4765909	Abandonnez le navire !
8344157	The Gairdner Foundation, established in 1957 by James Arthur Gairdner, is Canada's most prestigious science award.	8343920	La Fondation Gairdner, créée en 1957 par James Arthur Gairdner, donne les prix les plus prestigieux du Canada dans le domain de la science.
267109	Hot, dry areas will become hotter and drier.	525301	Les régions chaudes et sèches deviendront plus chaudes et plus sèches.
4378281	I stepped on something weird.	4313694	J’ai marché sur un truc bizarre.
499444	You can't build buildings on swampy land.	548863	Vous ne pouvez construire de bâtiments sur des terrains marécageux.
5636711	The first seven games were drawn.	5645635	Les sept premières parties ont fait égalité.
6814193	Snow is very good for the groundwater levels.	5990470	La neige c’est très bon pour les eaux souterraines.
484374	Given her complete lack of gratitude after all that I had done for her, I told myself that I would have done better by banging my head against the wall.	478103	Au vu de son manque total de gratitude, après tous les efforts que j'ai faits pour elle, je me dis que j'aurais mieux fait de pisser dans un violon.
54048	Sammy Davis was an excellent singer.	557555	Sammy Davis était un chanteur excellent.
847215	Our ancestors developed massive jaws as a result of constant combat.	1035623	Nos ancêtres ont développé des mâchoires imposantes à force de combats constants.
67337	Alice slid down the long slide.	10588	Alice glissa sur la longue pente.
2737005	Every two seconds somewhere on Earth a child dies of starvation, while elsewhere there are abundant food resources going to waste.	2737008	Toutes les deux secondes, quelque part sur Terre, un enfant meurt de faim pendant qu'autre part d'abondantes ressources alimentaires sont gâchées.
1216634	She made some derogatory remarks about her colleagues.	1217225	Elle a fait quelques remarques désobligeantes sur ses collègues.
6861432	A "gapers' delay" is a blocking of traffic caused by drivers who, out of curiosity, slow down to observe an accident.	6861287	Un « embouteillage de curieux » est un embarras de circulation causé par des conducteurs qui, par curiosité, ralentissent pour observer un accident.
5660737	The most profitable sectors in the United States and Europe are the military and pharmaceutical industries. Knowing this, there is no need to explain why there are always wars on Earth. Yes, it's a shame.	5660754	Les branches les plus prospères des États-Unis et de l'Europe sont l'industrie de l'armement et de la pharmacie. Sachant cela, il n'y a pas besoin d'expliquer pourquoi il y a toujours des guerres sur Terre. Oui, c'est une honte.
663003	Unskilled labor is poorly paid.	809729	Le travail non qualifié est mal payé.
5650606	What makes old age hard to bear is not the failing of one's faculties, mental and physical, but the burden of one's memories.	5654484	Ce qui rend la vieillesse difficile à supporter, ce n'est pas la défaillance des facultés, qu'elles soient mentales ou physiques, mais le poids des souvenirs.
5272265	You have no manners.	7839609	Vous êtes dépourvus de manières.
242667	It's awfully hot today.	8456	Il fait horriblement chaud aujourd'hui.
24135	Are we to remove our shoes before entering the house?	9603	Devons-nous retirer nos chaussures avant d'entrer dans la maison ?
3271515	When it comes to creating new contacts, Jérôme finds it difficult.	3271516	Quand il est question de créer de nouveaux contacts, Jérôme trouve cela difficile.
1557002	I heard him humming in the shower.	1557389	Je l'ai entendu fredonner sous la douche.
2263360	Who's that cute girl I saw you with at the mall?	2271516	Qui est cette mignonne fille avec laquelle je t'ai vu à la galerie commerciale ?
2800250	We'll join you shortly.	3926766	Nous vous rejoindrons dans peu de temps.
909568	Some healthcare workers spend more time doing paperwork than taking care of patients.	1406777	Certains employés de santé passent davantage de temps à faire de la paperasse qu'à prendre soin de patients.
1779855	A rack of lamb makes a great meal.	1784460	Un travers d'agneau constitue un repas de choix.
1167467	We still have more than halfway to go to get to the top of the mountain. Are you really already exhausted?	1168013	Nous avons encore plus de la moitié du chemin à parcourir pour atteindre le sommet. Êtes-vous vraiment déjà fatiguée ?
1071952	In order to unveil the international language, each lexical item should be written separately.	700973	Pour faire découvrir la langue internationale, on devrait écrire en faisant ressortir chaque lexie.
1973	The witnesses were able to refute the false testimony of the suspect.	3786	Les témoins ont pu réfuter le faux témoignage du suspect.
1148054	My hip hurts.	1148112	Ma hanche me fait mal.
5108184	Alice thought that Jack would ask her to the prom, but he asked someone else.	5802024	Alice pensait que Jack allait l'inviter pour le bal, mais il a invité quelqu'un d'autre.
2829708	I slipped on an icy patch.	4956883	J'ai glissé sur une plaque de verglas.
2438251	Let's go back to the motel.	5452474	Retournons au motel.
4986505	Clearly, it's a fraud.	8643502	Clairement, c'est une fraude.
9033653	Are you guys homeless?	5636750	Êtes-vous sans abri ?
1747539	What is for dessert?	839043	Qu'y a-t-il comme dessert ?
6329332	Sami examined Layla's injury.	6329659	Sami a examiné la blessure de Layla.
1636141	When you surf the web, you may be tracked by websites.	1638796	Lorsque vous naviguez sur la toile, il se peut que vous soyez pistées par des sites.
5716032	John is not the type of man who'd betray you.	549580	John n’est pas le genre de personne qui puisse te trahir.
20232	A fussy referee can ruin a bout.	1561116	Un arbitre tatillon peut ruiner un combat.
268575	Plants take in water from the soil.	237077	Les plantes tirent l'eau du sol.
1152647	Any member of the University has right to use the library services showing personal identification card or university badge.	1158185	Tout membre de l'université, muni de sa carte personnelle ou de son badge d'université, a accès à la bibliothèque.
2159106	Mount Fuji is extraordinary.	15679	Le mont Fuji est extraordinaire.
7045238	Selfie sticks are not allowed in this museum.	7074604	Les perches à selfie ne sont pas autorisés dans ce musée.
3742460	I met Christine yesterday.	553671	J'ai rencontré Christine hier.
4445259	The motor overheated and is now emitting smoke.	4466468	Le moteur a surchauffé et émet maintenant de la fumée.
3880345	I haven't seen the description.	8548080	Je n'ai pas vu la description.
28895	Although our universe is still young, theorists are busy exploring its ultimate fate.	332261	Bien que l'univers soit encore jeune, les théoriciens sont occupés à explorer son destin ultime.
2064129	He filed a complaint.	2066092	Il porta plainte.
1299965	Shall we play cowboy and Indians? I declare myself a sheriff, and you all must obey me.	1021285	On joue au cowboy et à l'Indien ? Je m'autoproclame shérif et vous devez tous m'obéir.
1683292	What an unfortunate coincidence!	1684668	Quelle regrettable coïncidence !
6148246	Do you know any kings?	8731600	Connais-tu des rois ?
2930900	These meetings are infinite and fruitless.	2930912	Ces réunions sont interminables et infructueuses.
2982409	Sites like Google or Facebook record everything that you write and don't respect your privacy.	8423555	Les plates-formes Web comme Google ou Facebook enregistrent tout ce que vous tapez et enfreignent votre vie privée.
7764407	Photography and videotaping are forbidden.	8537604	Les photos et les vidéos sont interdites.
522315	The lack of evidence to the contrary is itself evidence that your theory is probably right.	545248	L'absence de preuve du contraire est elle-même la preuve que votre théorie est probablement vraie.
6729445	Stop treating me like a child.	6729907	Arrêtez de me prendre pour une enfant.
2297074	After the wall was torn down, Berliners could view the two sides of Berlin at once for the first time since 1961.	2721841	Après la destruction du mur, les Berlinois ont pu voir les deux côtés de Berlin en même temps pour la première fois depuis 1961.
6445065	We need a crane to lift this slab.	8413862	Il nous faut une grue pour soulever cette dalle.
744551	After only a year her breast implants started to leak and she had to have them removed.	800245	Après seulement un an, ses implants mammaires commencèrent à fuir et elle dût les faire retirer.
885205	How could this happen? I thought you were on the pill.	885445	Comment cela a-t-il pu arriver ? Je pensais que tu prenais la pilule.
4478664	I don't drink vodka!	4524191	Je ne bois pas de vodka.
2091517	Norman Finkelstein's parents were survivors of the Holocaust.	2091522	Les parents de Norman Finkelstein étaient des survivants de l'Holocauste.
8816857	When I swallow I feel an intense pain caused by my elongated temporal styloid process. My condition is called "Eagle Syndrome".	8816856	Quand j'avale je ressens une douleur intense venant de mon processus styloïde temporal allongé. Ce malaise se nomme « syndrome d'Eagle ».
282848	In the country, the colors of the sky and of the foliage are entirely different from those seen in the city.	1056565	À la campagne, les couleurs du ciel et du feuillage sont entièrement différentes de celles qu'on voit en ville.
6091221	Aren't you Catholic?	9190527	N'êtes-vous pas catholiques?
6812443	I thought that you were a baron.	5279417	Je croyais que vous étiez baron.
2528229	I have the ace of spades.	5838560	J'ai l'as de pique.
3335882	One mustn't smoke because it causes illness.	1576837	Il ne faut pas fumer car cela provoque des maladies.
3592910	Tommy sang better than Eva did.	5370876	Tommy chanta mieux que Eva.
2245499	Flip a coin.	4625943	Lance une pièce !
270720	According to an estimate, steel production will reach 100 million tons this year.	8439405	Selon une estimation, la production d'acier atteindra 100 millions de tonnes cette année.
3495947	You always twist what I say.	3496529	Tu détournes tout ce que je dis.
29329	Lobsters belong to a class of marine animals.	13817	Les homards appartiennent à une catégorie d'animaux marins.
839875	Lo and behold!	4578513	Regarde là !
6836428	The cock, the hen, and his chicks pecked in the farmyard.	1437160	Le coq, la poule et ses poussins picorent dans la cour de la ferme.
906854	What's your favorite racing game?	1618974	Quel est votre jeu de course préféré ?
45698	The ship is not equipped with radar.	470379	Ce bateau n'est pas équipé de radar.
1968	Even now, many years after the Cold War, there is still much rancor between the Russians and the Germans, especially in areas once occupied by the Soviet Union.	3782	Même maintenant, des années après la Guerre Froide, il y a encore beaucoup de rancoeur entre les Russes et les Allemands, en particulier dans les régions autrefois occupées par l'Union Soviétique.
2090865	You don't want to be an editor?	2102228	Ne voulez-vous pas être rédactrice ?
1106922	In Japanese folklore, bakeneko are cats with magical powers.	1107094	Dans le folklore japonais, les bakenekos sont des chats possédant des pouvoirs magiques.
3346521	The structure of the language is also a structure of understanding.	3346928	La structure du langage est aussi une structure de compréhension.
7217336	I'm afraid that Jami isn't going to recover.	7960243	J'ai peur que Jami ne s'en remette pas.
655049	I will marshal a fair amount of scientific data to support my argument.	809951	Je rassemblerai une bonne quantité de données scientifiques pour corroborer ma thèse.
3446488	I bid you farewell.	3446558	Je vous souhaite bon voyage !
923357	Don't try to cover the whole sky with the palm of your hand.	3521188	N'essayez pas de couvrir le ciel entier de la paume de votre main.
8222198	I completely trust my inner voice.	8223667	Je fais entièrement confiance à ma voix intérieure.
1979784	The teapot is whistling.	6069290	La théière siffle.
19399	An izakaya is a Japanese-style pub.	9226	Un izakaya est un pub à la façon japonaise.
2011576	I want your analysis.	8709220	Je veux votre analyse.
45970	One king after another succeeded to the throne during those few years.	12180	Ils se sont succédé un roi après l'autre sur le trône pendant ces quelques années.
4922783	We need to repaint the barn.	6668618	Nous devons repeindre la grange.
300601	He is suspected of robbery.	132784	Il est suspecté de vol.
61166	This cake is made of the finest ingredients.	891239	Ce gâteau est fait des meilleurs ingrédients.
313390	She was beside herself with rage.	1071220	Elle était hors d'elle.
545608	The mythical Kraken, thick as a ship and three times as wide, once made an attack on Christopher Columbus's fleet... giving Columbus no choice but to eat him.	763342	Le mythique Kraken, trois fois plus gros qu'un bateau, attaqua un jour la flotte de Christophe Colomb... ne laissant d'autre choix à ce dernier que de manger le Kraken.
238405	The guards rotated in making their rounds every hour.	140151	Les gardes se relayent toutes les heures pour faire leurs rondes.
2714042	Do you speak Irish?	8735078	Parles-tu irlandais ?
1488710	Joe is brain damaged.	1692931	Joe a subi des dommages au cerveau.
6035781	Pierre didn't understand any of it.	6011711	Pierre n'y comprenait rien.
322637	All the seats are booked.	4868422	Tous les fauteuils sont réservés.
954162	Many native speakers of Japanese have trouble hearing the difference between B and V.	957493	De nombreux locuteurs natifs de la langue japonaise ont des difficultés à entendre la différence entre B et V.
4904156	The first rays of the sun tore the cloudy veil and the outline of a rocky island appeared.	1220765	Les premiers rayons du soleil déchirèrent le voile nuageux et les contours d'une île rocheuse apparurent.
3226249	It's me, he said softly.	3196300	C’est moi, dit-il doucement.
1771719	He's a junior employee.	1776415	C'est un employé subalterne.
2254686	Where's your medication?	8080136	Où sont tes médicaments ?
1517	That's very nice of you, Willie answered.	139011	« C'est très gentil de ta part », répondit Willie.
